SQL> set pause on
SQL> set pages 30
SQL> 
SQL> -- 1. output all possible pairs where the first player is a coach and the second an infielder
SQL> SELECT x.ename, y.ename from empbb02 x, empbb02 y WHERE x.deptno = 40 AND
  2  y.deptno = 10;

Wed Aug 05                                                             page    1
                                     LAB 5 
                                     CS 514

ENAME      ENAME                                                                
---------- ----------                                                           
rickey     robinson                                                             
rickey     gehrig                                                               
rickey     minoso                                                               
rickey     sandberg                                                             
rickey     cey                                                                  
lasorda    robinson                                                             
lasorda    gehrig                                                               
lasorda    minoso                                                               
lasorda    sandberg                                                             
lasorda    cey                                                                  
bochy      robinson                                                             
bochy      gehrig                                                               
bochy      minoso                                                               
bochy      sandberg                                                             
bochy      cey                                                                  
berra      robinson                                                             
berra      gehrig                                                               
berra      minoso                                                               
berra      sandberg                                                             
berra      cey                                                                  


                                  Report Done

20 rows selected.

SQL> 
SQL> -- 2a.Create a stored function whose input is a player last name and whose output is the uniform number of that player.
SQL> 
SQL> CREATE OR REPLACE FUNCTION getUNI(name IN empbb02.ename%TYPE)
  2  	 RETURN infobb02.uni%TYPE AS guni infobb02.uni%TYPE;
  3  BEGIN
  4    SELECT uni
  5    INTO guni
  6    FROM empbb02,infobb02
  7    WHERE empbb02.empno = infobb02.empno AND name = ename;
  8    RETURN(guni);
  9  END;
 10  /

Function created.










SQL> -- 2b. Write a script (unix file with sql extension) that calls this function for mungo.
SQL> 
SQL> -- tst5.sql (file that calls the function for mungo)
SQL> 
SQL> spool test5.dat
SQL> set echo on
SQL> set pages 100
SQL> SELECT ename, getuni('mungo') AS "uniform number"
  2  FROM empbb02 WHERE empbb02.ename = 'mungo';

Wed Aug 05                                                             page    1
                                     LAB 5 
                                     CS 514

ENAME                                                                           
----------                                                                      
uniform number                                                                  
--------------------------------------------------------------------------------
mungo                                                                           
31                                                                              
                                                                                


                                  Report Done

SQL> --set echo off
SQL> --spool off
SQL> 
SQL> -- 3a. Write a stored procedure whose input is a player last name and whose outputs are the appropriate restaurant and location.
SQL> CREATE OR REPLACE PROCEDURE empinfo(
  2    lastname IN empbb02.ename%TYPE,
  3    rest OUT VARCHAR2,
  4    locate OUT VARCHAR2) AS
  5  BEGIN
  6    SELECT deptbb02.restaurant, deptbb02.location
  7    INTO  rest, locate
  8    FROM empbb02, deptbb02
  9    WHERE empbb02.deptno = deptbb02.deptno AND lastname = ename;
 10  END;
 11  .
SQL> /

Procedure created.

SQL> SHOW ERRORS
No errors.
SQL> 
SQL> -- 3b. Test it.
SQL> set serveroutput on
SQL> set pages 100
SQL> DECLARE
  2    rest VARCHAR2(15);
  3    locate VARCHAR2(15);
  4    lastname VARCHAR2(10);
  5  BEGIN
  6    empinfo('minoso', rest, locate);
  7    DBMS_OUTPUT.PUT_LINE('dines at '||rest||
  8  	 ' which is located in '||locate);
  9  END;
 10  .
SQL> /
dines at Jade which is located in Clairmont                                     

PL/SQL procedure successfully completed.
-- 4. Arrange to invoke the procedure you stored in 3. above from a java jdbc program.
import java.io.*;
import java.sql.*;
import oracle.jdbc.pool.*;
public class jdbc4 {
  
  public static void main(String [] aa) {
    String url;
    url = "jdbc:oracle:thin:@cslabdb:1525:cfedb";
   
    Connection conn;
    try { 
      Class.forName("oracle.jdbc.driver.OracleDriver");
    }
    catch (Exception e) {
      System.out.println("MR.UnitSitQueries.constructor.Exception: " +
        e);
    }
    try {
      conn = DriverManager.getConnection(url,"st09","CS514"); 
      CallableStatement calStmt=conn.prepareCall("{call empinfo(?,?,?)}");
      String name = "minoso";
      calStmt.setString(1,name);
      calStmt.registerOutParameter(2,Types.VARCHAR);
      calStmt.registerOutParameter(3,Types.VARCHAR);
      calStmt.execute();   
      String eatery=calStmt.getString(2);
      String area=calStmt.getString(3);
      System.out.println(name+" dines at "+eatery+" which is located in "+area+".");
      calStmt.close();
      conn.close();
    }
    catch (SQLException e){System.err.println("OOPS " + e.getMessage());}
  }
}

-- 4. test
> javac jdbc4.java
> java jdbc4
minoso dines at Jade which is located in Clairmont.


























-- 5a.Write a java jdbc program that will allow the user to do make updates to the sal column of empbb02 from the keyboard as an application.
import java.io.*;
import java.sql.*;
public class jdbc {
  static BufferedReader getData = new BufferedReader(new InputStreamReader(
                 System.in));
  static String empno;
  static int sal;
  public static void main(String [] aa) throws IOException{
    String url;
    url = "jdbc:oracle:thin:@cslabdb:1525:cfedb";
        
    Connection conn;
    try { 
      Class.forName("oracle.jdbc.driver.OracleDriver");
    }
    catch (Exception e) {
      System.out.println("MR.UnitSitQueries.constructor.Exception: " +
        e);
    }
    try {
      conn = DriverManager.getConnection(url,"st09","cs514"); 
         
      PreparedStatement prepstmt = conn.prepareStatement(
         "UPDATE empbb02 SET sal = ? WHERE empno = ?"); 

      boolean done = false;
      while (!done) {
        needData();
        if (empno.equals("0")) {
          done = true; 
          continue;
        }
        prepstmt.setString(2,empno);
        prepstmt.setInt(1,sal);
        prepstmt.executeUpdate();
      }
      prepstmt.close();
      conn.close();
    }
    catch (SQLException e){System.err.println("OOPS " + e.getMessage());}
  }
  static void needData() throws IOException {
    System.out.println("Enter an employment number .  Enter 0 to quit.");
    empno = getData.readLine();
    if (!empno.equals("0")) {
      System.out.println("Enter a new salary.");
      sal = Integer.parseInt(getData.readLine());
      
    }
  }
}
  












-- 5b. Test it. Testing to change rickey’s salary from 10000 to 30000
> sqlplus st09/cs514@cfedb.sdsu.edu
SQL> select * from empbb02;

EMPNO ENAME      POS          BOSS HIREDATE         SAL     DEPTNO INCENTIVES   
----- ---------- ------------ ---- --------- ---------- ---------- ----------   
729   robinson   second base  712  15-APR-47      50000         10              
712   rickey     gm                01-JAN-98      10000         40              
735   lasorda    coach        712  10-JAN-98       2000         40              
707   bochy      coach        712  11-JAN-98       2000         40              
798   berra      coach        712  12-JAN-98       2000         40              
782   musial     right field  707  01-FEB-98      42000         20              
763   gehrig     first base   735  11-MAR-98      85000         10              
777   minoso     shortstop    735  05-MAY-98      85000         10       6000   
721   sandberg   second base  735  28-FEB-98      25000         10              
788   cey        third base   735  10-JAN-99      15000         10       8000   
720   williams   left field   707  05-JAN-99     150000         20              
755   johnson    pitcher      798  08-NOV-98      50000         30              
744   brown      pitcher      798  18-OCT-99      40000         30       4000   
730   mays       center field 707  01-JAN-96     240000         20              
799   mungo      pitcher      798  10-MAR-00      20000         30      12000   
766   rodriguez  catcher      735  16-OCT-01     100000         50              

SQL> quit

> javac jdbc.java
> java jdbc
Enter an employment number .  Enter 0 to quit.
712
Enter a new salary.
30000
Enter an employment number .  Enter 0 to quit.
0
> sqlplus st09/cs514@cfedb.sdsu.edu
SQL> select * from empbb02;

EMPNO ENAME      POS          BOSS HIREDATE         SAL     DEPTNO INCENTIVES
----- ---------- ------------ ---- --------- ---------- ---------- ----------
729   robinson   second base  712  15-APR-47      50000         10
712   rickey     gm                01-JAN-98      30000         40
735   lasorda    coach        712  10-JAN-98       2000         40
707   bochy      coach        712  11-JAN-98       2000         40
798   berra      coach        712  12-JAN-98       2000         40
782   musial     right field  707  01-FEB-98      42000         20
763   gehrig     first base   735  11-MAR-98      85000         10
777   minoso     shortstop    735  05-MAY-98      85000         10       6000
721   sandberg   second base  735  28-FEB-98      25000         10
788   cey        third base   735  10-JAN-99      15000         10       8000
720   williams   left field   707  05-JAN-99     150000         20
755   johnson    pitcher      798  08-NOV-98      50000         30
744   brown      pitcher      798  18-OCT-99      40000         30       4000
730   mays       center field 707  01-JAN-96     240000         20
799   mungo      pitcher      798  10-MAR-00      20000         30      12000
766   rodriguez  catcher      735  16-OCT-01     100000         50

16 rows selected.


SQL> 







SQL> -- 6a. Add a table called newhires, with fields empno, ename, hiredate.
SQL> CREATE TABLE newhires (empno VARCHAR2(10), ename VARCHAR2(10), hiredate DATE);

Table created.

SQL> desc newhires
 Name                                      Null?    Type
 ----------------------------------------- -------- ----------------------------
 EMPNO                                              VARCHAR2(10)
 ENAME                                              VARCHAR2(10)
 HIREDATE                                           DATE

SQL> 
SQL> -- 6b.Write a trigger so that if you add an employee, he/she will be placed in the newhires table.
SQL> CREATE OR REPLACE TRIGGER tron
  2  AFTER INSERT ON empbb02
  3  FOR EACH ROW
  4  BEGIN
  5  INSERT INTO newhires VALUES (:new.empno, :new.ename, :new.hiredate);
  6  END;
  7  /

Trigger created.

SQL> 
SQL> desc newhires
 Name                                      Null?    Type
 ----------------------------------------- -------- ----------------------------
 EMPNO                                              VARCHAR2(10)
 ENAME                                              VARCHAR2(10)
 HIREDATE                                           DATE

SQL> INSERT INTO empbb02 VALUES ('794', 'winchester', 'catcher', '712', '04-AUG-2015', 100000, 50, null);

1 row created.

SQL> select * from newhires;

Wed Aug 05                                                             page    1
                                     LAB 5 
                                     CS 514

EMPNO      ENAME      HIREDATE                                                  
---------- ---------- ---------                                                 
794        winchester 04-AUG-15                                                 





                                  Report Done

SQL> 











SQL> -- 6c. Presumably, after attending orientation, the new hire can be deleted from the newhires table.
SQL> DELETE FROM newhires WHERE empno = '794';

1 row deleted.

SQL> select * from newhires;

no rows selected

SQL> select * from empbb02;

Wed Aug 05                                                             page    1
                                     LAB 5 
                                     CS 514

EMPNO ENAME      POS          BOSS HIREDATE         SAL     DEPTNO INCENTIVES   
----- ---------- ------------ ---- --------- ---------- ---------- ----------   
729   robinson   second base  712  15-APR-47      50000         10              
712   rickey     gm                01-JAN-98      30000         40              
735   lasorda    coach        712  10-JAN-98       2000         40              
707   bochy      coach        712  11-JAN-98       2000         40              
798   berra      coach        712  12-JAN-98       2000         40              
782   musial     right field  707  01-FEB-98      42000         20              
763   gehrig     first base   735  11-MAR-98      85000         10              
777   minoso     shortstop    735  05-MAY-98      85000         10       6000   
721   sandberg   second base  735  28-FEB-98      25000         10              
788   cey        third base   735  10-JAN-99      15000         10       8000   
720   williams   left field   707  05-JAN-99     150000         20              
755   johnson    pitcher      798  08-NOV-98      50000         30              
744   brown      pitcher      798  18-OCT-99      40000         30       4000   
730   mays       center field 707  01-JAN-96     240000         20              
799   mungo      pitcher      798  10-MAR-00      20000         30      12000   
766   rodriguez  catcher      735  16-OCT-01     100000         50              
794   winchester catcher      712  04-AUG-15     100000         50              




                                  Report Done

17 rows selected.

SQL> 
SQL> spool off
